{
  "schemaVersion": 2,
  "packageName": "WSR-Core",
  "version": "1.5.0",
  "buildId": "WSR-CORE-1.5.0-RELEASE",
  "status": "Released",
  "createdAt": "2026-08-27T10:00:00+07:00",
  "canonicalLayout": ".agents",
  "compatibilityLayouts": [
    ".agents",
    ".codex",
    ".gemini"
  ],
  "minimumPython": "3.8",
  "policySource": "GEMINI.md",
  "checksumsFile": "WSR_CHECKSUMS.json",
  "contextFile": "WSR_CONTEXT.json",
  "cleanWhitelist": [
    "DATA/",
    "ENGINE/",
    "Template/",
    "Tools/assets/",
    "DOCS/Planning/",
    ".git/",
    ".agents/",
    ".codex/"
  ],
  "packageExclusions": [
    "__pycache__/",
    "*.pyc",
    "desktop.ini",
    "*.zip",
    ".git",
    ".git/",
    ".DS_Store",
    "Thumbs.db",
    "memory/",
    "metadata.json",
    "DOCS/"
  ],
  "adapters": [
    "adapters/codex.json",
    "adapters/gemini.json",
    "adapters/claude.json",
    "adapters/cursor.json",
    "adapters/antigravity.json",
    "adapters/generic.json"
  ],
  "artifacts": [
    {
      "id": "gemini-policy",
      "source": "GEMINI.md",
      "type": "policy",
      "required": true,
      "mutable": false,
      "deploy": true,
      "targets": [
        "codex",
        "gemini",
        "antigravity"
      ],
      "owner": "Tech Lead",
      "encoding": "UTF-8"
    },
    {
      "id": "agents-config",
      "source": "AGENTS.md",
      "type": "policy",
      "required": true,
      "mutable": true,
      "deploy": true,
      "targets": [
        "codex",
        "gemini",
        "antigravity"
      ],
      "owner": "Tech Lead",
      "encoding": "UTF-8"
    },
    {
      "id": "readme-doc",
      "source": "README.html",
      "type": "document",
      "required": true,
      "mutable": true,
      "deploy": true,
      "targets": [
        "codex",
        "gemini",
        "antigravity"
      ],
      "owner": "Documentation Engineer",
      "encoding": "UTF-8"
    },
    {
      "id": "readme-md",
      "source": "README.md",
      "type": "document",
      "required": true,
      "mutable": true,
      "deploy": true,
      "targets": [
        "codex",
        "gemini",
        "antigravity"
      ],
      "owner": "Documentation Engineer",
      "encoding": "UTF-8"
    },
    {
      "id": "install-guide",
      "source": "Installation_guide.txt",
      "type": "document",
      "required": true,
      "mutable": true,
      "deploy": true,
      "targets": [
        "codex",
        "gemini",
        "antigravity"
      ],
      "owner": "Documentation Engineer",
      "encoding": "UTF-8"
    },
    {
      "id": "manifest",
      "source": "WSR_MANIFEST.json",
      "type": "document",
      "required": true,
      "mutable": true,
      "deploy": true,
      "targets": [
        "codex",
        "gemini",
        "antigravity"
      ],
      "owner": "Configuration Engineer",
      "encoding": "UTF-8"
    },
    {
      "id": "debt-ledger",
      "source": "debt_ledger.md",
      "type": "generated",
      "required": true,
      "mutable": true,
      "deploy": true,
      "targets": [
        "codex",
        "gemini",
        "antigravity"
      ],
      "owner": "Python Tooling Engineer B",
      "encoding": "UTF-8"
    },
    {
      "id": "global-rules",
      "source": "global_rules/AG_GLOBAL_RULES.md",
      "type": "rule",
      "required": true,
      "mutable": false,
      "deploy": true,
      "targets": [
        "codex",
        "gemini",
        "antigravity"
      ],
      "owner": "Tech Lead",
      "encoding": "UTF-8"
    },
    {
      "id": "workflow-audit",
      "source": "global_workflows/audit.md",
      "type": "workflow",
      "required": true,
      "mutable": false,
      "deploy": true,
      "targets": [
        "codex",
        "gemini",
        "antigravity"
      ],
      "owner": "Workflow Engineer",
      "encoding": "UTF-8"
    },
    {
      "id": "workflow-backup",
      "source": "global_workflows/backup.md",
      "type": "workflow",
      "required": true,
      "mutable": false,
      "deploy": true,
      "targets": [
        "codex",
        "gemini",
        "antigravity"
      ],
      "owner": "Workflow Engineer",
      "encoding": "UTF-8"
    },
    {
      "id": "workflow-br",
      "source": "global_workflows/br.md",
      "type": "workflow",
      "required": true,
      "mutable": false,
      "deploy": true,
      "targets": [
        "codex",
        "gemini",
        "antigravity"
      ],
      "owner": "Workflow Engineer",
      "encoding": "UTF-8"
    },
    {
      "id": "workflow-goal",
      "source": "global_workflows/goal.md",
      "type": "workflow",
      "required": true,
      "mutable": false,
      "deploy": true,
      "targets": [
        "codex",
        "gemini",
        "antigravity"
      ],
      "owner": "Workflow Engineer",
      "encoding": "UTF-8"
    },
    {
      "id": "workflow-clean",
      "source": "global_workflows/clean.md",
      "type": "workflow",
      "required": true,
      "mutable": false,
      "deploy": true,
      "targets": [
        "codex",
        "gemini",
        "antigravity"
      ],
      "owner": "Workflow Engineer",
      "encoding": "UTF-8"
    },
    {
      "id": "workflow-commit",
      "source": "global_workflows/commit.md",
      "type": "workflow",
      "required": true,
      "mutable": false,
      "deploy": true,
      "targets": [
        "codex",
        "gemini",
        "antigravity"
      ],
      "owner": "Workflow Engineer",
      "encoding": "UTF-8"
    },
    {
      "id": "workflow-ho",
      "source": "global_workflows/ho.md",
      "type": "workflow",
      "required": true,
      "mutable": false,
      "deploy": true,
      "targets": [
        "codex",
        "gemini",
        "antigravity"
      ],
      "owner": "Workflow Engineer",
      "encoding": "UTF-8"
    },
    {
      "id": "workflow-pl",
      "source": "global_workflows/pl.md",
      "type": "workflow",
      "required": true,
      "mutable": false,
      "deploy": true,
      "targets": [
        "codex",
        "gemini",
        "antigravity"
      ],
      "owner": "Workflow Engineer",
      "encoding": "UTF-8"
    },
    {
      "id": "workflow-reload",
      "source": "global_workflows/reload.md",
      "type": "workflow",
      "required": true,
      "mutable": false,
      "deploy": true,
      "targets": [
        "codex",
        "gemini",
        "antigravity"
      ],
      "owner": "Workflow Engineer",
      "encoding": "UTF-8"
    },
    {
      "id": "workflow-wsr",
      "source": "global_workflows/wsr.md",
      "type": "workflow",
      "required": true,
      "mutable": false,
      "deploy": true,
      "targets": [
        "codex",
        "gemini",
        "antigravity"
      ],
      "owner": "Workflow Engineer",
      "encoding": "UTF-8"
    },
    {
      "id": "workflow-sync",
      "source": "global_workflows/sync.md",
      "type": "workflow",
      "required": true,
      "mutable": false,
      "deploy": true,
      "targets": [
        "codex",
        "gemini",
        "antigravity"
      ],
      "owner": "Workflow Engineer",
      "encoding": "UTF-8"
    },
    {
      "id": "skill-wsr-audit",
      "source": "skills/wsr-audit/SKILL.md",
      "type": "skill",
      "required": true,
      "mutable": false,
      "deploy": true,
      "targets": [
        "codex",
        "gemini",
        "antigravity"
      ],
      "owner": "Workflow Engineer",
      "encoding": "UTF-8"
    },
    {
      "id": "skill-wsr-debt",
      "source": "skills/wsr-debt/SKILL.md",
      "type": "skill",
      "required": true,
      "mutable": false,
      "deploy": true,
      "targets": [
        "codex",
        "gemini",
        "antigravity"
      ],
      "owner": "Workflow Engineer",
      "encoding": "UTF-8"
    },
    {
      "id": "skill-wsr-review",
      "source": "skills/wsr-review/SKILL.md",
      "type": "skill",
      "required": true,
      "mutable": false,
      "deploy": true,
      "targets": [
        "codex",
        "gemini",
        "antigravity"
      ],
      "owner": "Workflow Engineer",
      "encoding": "UTF-8"
    },
    {
      "id": "global-skill-dec-dev-operator",
      "source": "global_skills/dec-dev-operator/SKILL.md",
      "type": "skill",
      "required": true,
      "mutable": false,
      "deploy": true,
      "targets": [
        "codex",
        "gemini",
        "antigravity"
      ],
      "owner": "Workflow Engineer",
      "encoding": "UTF-8"
    },
    {
      "id": "global-skill-dec-dev-ref",
      "source": "global_skills/dec-dev-operator/references/DEC_UI_skill.md",
      "type": "skill",
      "required": true,
      "mutable": false,
      "deploy": true,
      "targets": [
        "codex",
        "gemini",
        "antigravity"
      ],
      "owner": "Workflow Engineer",
      "encoding": "UTF-8"
    },
    {
      "id": "global-skill-effective-html",
      "source": "global_skills/effective-html/SKILL.md",
      "type": "skill",
      "required": true,
      "mutable": false,
      "deploy": true,
      "targets": [
        "codex",
        "gemini",
        "antigravity"
      ],
      "owner": "Workflow Engineer",
      "encoding": "UTF-8"
    },
    {
      "id": "global-skill-liquid-glass-readme",
      "source": "global_skills/LiquidGlass/Readme.html",
      "type": "document",
      "required": true,
      "mutable": false,
      "deploy": true,
      "targets": [
        "codex",
        "gemini",
        "antigravity"
      ],
      "owner": "Workflow Engineer",
      "encoding": "UTF-8"
    },
    {
      "id": "global-skill-liquid-glass",
      "source": "global_skills/LiquidGlass/skills/liquid-glass-web-win/SKILL.md",
      "type": "skill",
      "required": true,
      "mutable": false,
      "deploy": true,
      "targets": [
        "codex",
        "gemini",
        "antigravity"
      ],
      "owner": "Workflow Engineer",
      "encoding": "UTF-8"
    },
    {
      "id": "global-skill-output",